Santee School District,7.59%,"$4,287,284.00 ",Improve student learning and demonstrate annual growth in California Standards in all academic content areas to prepare students academically for high school and beyond.,"Improve and/or increase services to support the social, emotional, and physical well-being of students and promote compassionate care for self, others, and the community.",Improve and/or increase parent participation and engagement in their child(ren)’s learning process in preparation for high school and beyond.,,,,
Solana Beach School District,3.74%,"$877,546.00 ",All students will demonstrate growth towards meeting or exceeding grade-level standards.,"Students will experience a safe, purposeful, collaborative learning environment that fosters healthy habits, positive
relationships, civic responsibility and values diversity so that their physical, mental, and social-emotional needs are met.",,,,,
South Bay Union School District,30.94%,"$12,131,326.00 ","Ensuring Academic Excellence: Provide a differentiated, responsive, and well-rounded academic experience based on instructional practices that make a significant difference in the lives of all students.",Advancing Equity and Inclusion: Create a culture of equity and inclusion through the elimination of systemic barriers to individual success and the development of culturally responsive practices.,Welcoming and Safe Learning Environments: Create learning environments which support the social-emotional needs of students and foster a sense of belonging and connectedness.,,,,
Spencer Valley School District,2.30%,"$35,945.00 ",Each student will experience high quality teaching and learning that will allow them to be successful in preparing for their College and Career,Students will attend school regularly and be engaged in a safe environment that fosters school connectedness,Students will have more access to enrichment opportunities both during the school and after school by increasing or maintaining School-Family- Community Partnerships and community involvement,Establish Multi-Tiered System of Support and prioritize Social-Emotional Learning,,,
Sweetwater Union High School District,15.67%,"$54,731,943.00 ",Ensure excellence in teaching and learning so each student is prepared to succeed in college and career.,Create a safe and healthy learning environment for each student by building a culture of equity and a positive climate that promotes excellence throughout the district.,Foster and honor parent/guardian and community engagement to support excellence in each student's success.,Develop coherent and transparent systems for operational excellence to support each student's success.,,,
Vallecitos School District,39.45%,"$630,508.00 ","As a collaborative team, we will improve student learning in reading/language arts as measured by district summative and
the CAASPP state exam.","As a collaborative team, we will improve student learning in mathematics as measured by district summative and the
CAASPP state exam.","Improve school climate and parental involvement related to the mission, core values, and goals of the district.",,,,
Valley Center-Pauma Unified School District,11.87%,"$4,014,024.00 ","Every student is actively engaged in learning, feels safe at school and demonstrates good citizenship.","Every student receives high quality instruction leading to academic achievement and physical fitness, successfully
preparing them for college and career readiness.","Parents, guardians and students are informed with timely district, school and classroom information and have
opportunities to provide input for decision-making.",,,,
Vista Unified School District,12.00%,"$33,760,214.00 ","Our students, parents, and staff will have equitable access to the conditions of learning necessary to promote excellence and innovation.",Our students will demonstrate improved outcomes that close the achievement gap and prepare them for success in college and career.,"Our students will be engaged in their learning through critical thinking, collaboration, and relevant connections to real-world problem-solving.",,,,
Warner Unified School District,23.39%,"$473,945.00 ",Increase achievement for all students and close the achievement gap which will better prepare students to graduate college and career ready.,"The District will provide students with a clean, healthy, physically and emotionally safe learning environment.","Parents, staff and local community members are engaged in the school and student learning and work collaboratively to support kids to increase learning.",,,,
